"location","title","desc","link","date"
"seturan","Nikmatnya Bakso Rosso Buat Kamu Ketagihan","Krjogja.com - BAKSO adalah kuliner Indonesia yang disukai oleh berbagai 
kalangan dan usia. Panganan khas Indonesia ini pun sangat mudah ditemui,...","https://www.krjogja.com/wisata/read/477961/nikmatnya-bakso-rosso-buat-kamu-ketagihan","bulan lalu"
"seturan","7 Nasi Goreng Enak di Jogja Buat Makan Malam, dari Nasi Goreng Padmanaba sampai Nasgor 212 Seturan","Dengan sajiannya yang menggugah selera, nasi goreng enak di Jogja selalu 
diburu untuk menu makan malam.","https://travel.tribunnews.com/2022/10/19/7-nasi-goreng-enak-di-jogja-buat-makan-malam-dari-nasi-goreng-padmanaba-sampai-nasgor-212-seturan","bulan lalu"
"seturan","Rekomendasi Kuliner Jogja Menu Serba Mie : Mie Ayam, Yamie, Bakmie","TRIBUNJOGJA.COM - Kuliner Jogja, Jika anda pecinta olahan mie, di Jogja 
terdapat spot makan mie yang bisa anda cobain. Kuliner Jogja ini langganan 
banyak...","https://jogja.tribunnews.com/2022/10/10/rekomendasi-kuliner-jogja-menu-serba-mie-mie-ayam-yamie-bakmie","bulan lalu"
"seturan","Rekomendasi 3 Kuliner Ayam Bakar Enak di Jogja, Cocok untuk Menu Makan Malam","Tribun Jogja merangkum rekomendasi tiga kuliner ayam bakar enak di Jogja, 
cocok untuk menu makan malam:","https://jogja.tribunnews.com/2022/09/06/rekomendasi-3-kuliner-ayam-bakar-enak-di-jogja-cocok-untuk-menu-makan-malam","Sep 2022"
"seturan","Rekomendasi Kuliner Bubur Enak di Jogja yang Cocok untuk Sarapan, Ada yang Buka Sampai Malam","Untuk kamu yang sedang berlibr ke Jogja dan bingung pilih makan bubur 
dimana, Inilah beberapa Kuliner Jogja rekomendasi tempat makan.","https://jogja.tribunnews.com/2022/09/03/rekomendasi-kuliner-bubur-enak-di-jogja-yang-cocok-untuk-sarapan-ada-yang-buka-sampai-malam","Sep 2022"
"seturan","Kuliner Jogja: Nikmati Sajian Kudapan Manis di Yogyakarta, Cocok Jadi Teman Nongkrong","Bagi yang ingin nongkrong santai sambil menikmati sajian kudapan manis, 
simak 4 rekomendasi tempat untuk menikmati yang manis-manis di Jogja!","https://jogja.tribunnews.com/2022/08/10/kuliner-jogja-nikmati-sajian-kudapan-manis-di-yogyakarta-cocok-jadi-teman-nongkrong","10 Agu 2022"
"seturan","Kuliner Jogja: Rekomendasi Dimsum Enak di Jogja","TRIBUNJOGJA.COM - Kuliner Jogja tidak ada habisnya, mulai dari makanan 
ringan, jajanan, hingga makanan berat semua rasa masakannya khas.","https://jogja.tribunnews.com/2022/08/09/kuliner-jogja-rekomendasi-dimsum-enak-di-jogja","Agu 2022"
"seturan","5 Tempat Makan di Jogja yang Baru dan Terkenal Murah","Jogja terkenal dengan kuliner yang lezat, mulai dari yang tradisional 
hingga yang kekinian. Beberapa juga tak hanya menawarkan olahan yang 
lezat,...","https://jogja.idntimes.com/food/dining-guide/senja-sandera/tempat-makan-di-jogja-yang-baru-dan-terkenal-murah-c1c2","1 Mei 2022"
"seturan","3 Tempat Makan Dimsum di Jogja yang Terkenal Enak, Dimsum Taiger Sprung Teksturnya Kenyal dan Lembut","TRIBUNTRAVEL.COM - Ingin camilan yang beragam dan enak di Jogja? Kamu bisa 
mencoba sajian dimsum. Jogja memiliki sejumlah tempat makan dimsum enak.","https://travel.tribunnews.com/2022/02/22/3-tempat-makan-dimsum-di-jogja-yang-terkenal-enak-dimsum-taiger-sprung-teksturnya-kenyal-dan-lembut","2 Feb 2022"
"seturan","15 Nasi Goreng Enak di Yogyakarta, Cocok untuk Makan Malam - Kompas.com","Coba 15 tempat makan nasi goreng enak di Yogyakarta berikut. Menu yang 
disajikan macam-macam, mulai dari nasi goreng jawa hingga kambing. Halaman 
all.","https://www.kompas.com/food/read/2022/02/20/220300275/15-nasi-goreng-enak-di-yogyakarta-cocok-untuk-makan-malam?page=all","20 Feb 2022"
"seturan","Rekomendasi Makanan Pedas Jogja, Nikmatnya Membakar Lidah!","Kota Jogja yang identik dengan Gudeg ini, punya banyak tempat makan yang 
menyajikan masakan pedas.","https://jogja.tribunnews.com/2022/01/10/rekomendasi-makanan-pedas-jogja-nikmatnya-membakar-lidah","10 Jan 2022"
"seturan","Sedap Banget! Menjajal Kuliner di Sambal Gami Bu Sumar - GenPI.co JOGJA","Sambal Gami Bu Sumar, salah satu kuliner baru di Yogyakarta yang wajib 
untuk dicoba. - GenPI.co JOGJA.","https://jogja.genpi.co/kafe-dan-resto/2969/sedap-banget-menjajal-kuliner-di-sambal-gami-bu-sumar","Des 2021"
"seturan","15 Tempat Makan Ramah Anak di Yogyakarta, Ada yang Punya Area Bermain - Kompas.com","KOMPAS.com - Membawa anak-anak untuk makan di luar tentu menjadi tantangan 
tersendiri. Terlebih jika anak masih dalam usia balita.","https://www.kompas.com/food/read/2021/12/02/211200675/15-tempat-makan-ramah-anak-di-yogyakarta-ada-yang-punya-area-bermain?page=all","Des 2021"
"seturan","16 Kuliner Malam di Yogyakarta, Ada Gudeg Hingga Mie Ayam - Kompas.com","Berikut 16 rekomendasi kuliner malam di Yogyakarta yang wajib dikunjungi 
saat jalan-jalan di sana. Pilihan menunya beragam dan harganya bervariasi.","https://www.kompas.com/food/read/2021/11/22/180600875/16-kuliner-malam-di-yogyakarta-ada-gudeg-hingga-mie-ayam?page=all","2 Nov 2021"
"seturan","Rekomendasi 5 Roti Bakar Manis dan Enak di Jogja","TRIBUNJOGJA. COM - Ingin mencoba jajaran tempat roti bakar di Jogja yang 
murah dan tentunya tidak kalah rasanya, enak disantap kala cuaca sedang...","https://jogja.tribunnews.com/2021/11/05/rekomendasi-5-roti-bakar-manis-dan-enak-di-jogja","Nov 2021"
"seturan","6 Bubur Ayam Enak di Jogja, Harganya Murah dan Porsinya Besar","Rekomendasi tempat wisata kuliner bubur ayam enak di jogja, yang harganya 
murah dan porsinya cukup besar.","https://travel.tribunnews.com/2021/11/04/6-bubur-ayam-enak-di-jogja-harganya-murah-dan-porsinya-besar","Nov 2021"
"seturan","Rekomendasi 5 Ayam Bakar Enak dan Murah di Jogja","Buat kalian pecinta kuliner yang berada di jogja dan ingin sekali mencoba 
ayam bakar, boleh mencoba sebentar ayam taliwang papin.","https://jogja.tribunnews.com/2021/11/01/rekomendasi-5-ayam-bakar-enak-dan-murah-di-jogja","Nov 2021"
"seturan","7 Tempat Nongkrong di Jogja yang Wajib Dikunjungi, Lokasinya Dekat Malioboro dan UGM","Ini dia tempat-tempat nongki epic nan hits tentunya dengan harga yang 
bersahabat di Jogja.","https://jogja.tribunnews.com/2021/10/22/7-tempat-nongkrong-di-jogja-yang-wajib-dikunjungi-lokasinya-dekat-malioboro-dan-ugm","2 Okt 2021"
"seturan","15 Mie Ayam Enak di Yogyakarta, Favorit Warga Lokal dan Wisatawan - Kompas.com","Berikut 15 rekomendasi warung mie ayam enak di Yogyakarta yang wajib 
dicoba. Beberapa di antaranya cukup terkenal. Halaman all.","https://www.kompas.com/food/read/2021/10/15/121200975/15-mie-ayam-enak-di-yogyakarta-favorit-warga-lokal-dan-wisatawan?page=all","5 Okt 2021"
"seturan","Viral Kuliner Sambal Belut Pak Wardi di Sleman Yogyakarta","Kuliner Sambal Belut Pak Wardi yang berada di Caturtunggal, Depok, Sleman 
Yogyakarta ini viral. Seperti apa sensasinya?","https://bacajogja.id/2021/10/04/viral-kuliner-sambal-belut-pak-wardi-di-sleman-yogyakarta/","Okt 2021"
"seturan","15 Cafe di Sleman Yogyakarta yang Cocok untuk Kerja - Kompas.com","Berikut 15 rekomendasi kafe di Sleman Yogyakarta yang cocok untuk bekerja 
atau mengerjakan tugas. Suasananya nyaman dan tenang. Halaman all.","https://www.kompas.com/food/read/2021/10/01/180400575/15-cafe-di-sleman-yogyakarta-yang-cocok-untuk-kerja?page=all","Okt 2021"
"seturan","15 Cafe Murah di Yogyakarta, Harga Mulai Rp 8.000 - Kompas.com","Berikut 15 rekomendasi kafe murah di Yogyakarta yang cocok untuk akhir 
bulan. Pilihannya menunya beragam dan harganya pun terjangkau. Halaman all.","https://www.kompas.com/food/read/2021/09/26/110600075/15-cafe-murah-di-yogyakarta-harga-mulai-rp-8.000?page=all","6 Sep 2021"
"seturan","15 Cafe Instagramble di Yogyakarta, Bikin Betah Nongkrong - Kompas.com","Berikut 15 kafe instagramble di Yogyakarta yang cocok dikunjungi untuk 
akhir pekan. Cocok untuk bersantai atau foto OOTD. Halaman all.","https://www.kompas.com/food/read/2021/09/18/110200375/15-cafe-instagramble-di-yogyakarta-bikin-betah-nongkrong?page=all","8 Sep 2021"
"seturan","7 Restoran Seafood di Yogyakarta, Terkenal untuk Wisata Kuliner - Kompas.com","KOMPAS.com - Saat berkunjung ke Yogyakarta, jangan lupa untuk menyempatkan 
menikmati aneka kuliner yang ada di sana. Salah satunya, aneka masakan 
hasil laut...","https://www.kompas.com/food/read/2021/09/15/201100175/7-restoran-seafood-di-yogyakarta-terkenal-untuk-wisata-kuliner?page=all","5 Sep 2021"
"seturan","Nikmatnya Cicipi Lontong Kikil Pak Yanto yang Viral di Yogyakarta","Media sosial kembali dibuat heboh dengan kehadiran kuliner serba jeroan di 
Seturan, Yogyakarta. Tempat makan milik pak Yanto itu terkenal nikmat 
setelah...","https://lifestyle.sindonews.com/read/518986/185/nikmatnya-cicipi-lontong-kikil-pak-yanto-yang-viral-di-yogyakarta-1629691714","3 Agu 2021"
"seturan","Lezatnya Lontong Kikil Pak Yanto yang Viral, Belum Buka Sudah Ramai Antrean","YOGYAKARTA memiliki beragam aneka kuliner. Kali ini ada satu yang khas dan 
viral di media sosial. Ya, lontong kikil warung pak Yanto.","https://travel.okezone.com/read/2021/08/23/301/2459622/lezatnya-lontong-kikil-pak-yanto-yang-viral-belum-buka-sudah-ramai-antrean","3 Agu 2021"
"seturan","Viral Kuliner Lontong Kikil Pak Yanto di Yogyakarta, Belum Buka Sudah Antre","Travelling ke Daerah Istimewa Yogyakarta belum lengkap tanpa wisata 
kuliner. Sudah menjadi hal umum jika Yogyakarta, memiliki kuliner yang 
lezat.","https://www.inews.id/travel/kuliner/viral-kuliner-lontong-kikil-pak-yanto-di-yogyakarta-belum-buka-sudah-antre","3 Agu 2021"
"seturan","Baru Dibuka Seminggu, Antrean Lontong Kikil Pak Yanto Mengul","Sleman, IDN Times - Penikmat kuliner Jogja daging sapi di Sleman kini bisa 
mencoba Lontong Kikil Pak Yanto. Baru sekitar sepekan dibuka, warung yang 
berada...","https://jogja.idntimes.com/food/dining-guide/febriana-sintasari/baru-dibuka-seminggu-antrean-lontong-kikil-pak-yanto-mengular","2 Agu 2021"
"seturan","5 Cafe Kekinian di Jogja yang Nyaman untuk Ngerjain Tugas - Portal Jogja","PORTAL JOGJA - Apakah kalian tipe orang yang sering merasa bosan ketika 
harus mengerjakan tugas? Jika iya, kalian bisa mencoba tempat baru dan 
suasana baru...","https://portaljogja.pikiran-rakyat.com/lifestyle/pr-252063211/5-cafe-kekinian-di-jogja-yang-nyaman-untuk-ngerjain-tugas","6 Jun 2021"
"seturan","15 Tempat Sarapan di Yogyakarta, dari Camilan hingga Makanan Berat - Kompas.com","Berikut 15 rekomendasi tempat sarapan di Yogyakarta yang wajib kamu 
kunjungi. Silakan coba jika kebetulan sedang di Yogyakarta. Halaman all.","https://www.kompas.com/food/read/2021/05/30/090200875/15-tempat-sarapan-di-yogyakarta-dari-camilan-hingga-makanan-berat?page=all","30 Mei 2021"
"seturan","15 Bakmi Jawa Enak di Yogyakarta, Favorit Warga Lokal dan Wisatawan - Kompas.com","Jika kebetulan sedang berada di Yogyakarta, silakan mampir ke 15 tempat 
makan bakmi jawa enak berikut. Halaman all.","https://www.kompas.com/food/read/2021/05/22/220200175/15-bakmi-jawa-enak-di-yogyakarta-favorit-warga-lokal-dan-wisatawan?page=all","2 Mei 2021"
"seturan","5 Rekomendasi Terbaru yang Cocok untuk Berbuka Bersama di Jogja - kumparan.com","Di bulan puasa ini pastinya masih banyak dari kita yang mencari berbagai 
referensi makanan terbaru yang ada di Jogja. Di Jogja ada beberapa 
rekomendasi...","https://kumparan.com/rijilli-fefuli/5-rekomendasi-terbaru-yang-cocok-untuk-berbuka-bersama-di-jogja-1vbqU1ZeK6j","4 Apr 2021"
"seturan","15 Tempat Makan Keluarga di Yogyakarta, Cocok untuk Akhir Pekan - Kompas.com","KOMPAS.com - Ada banyak tempat makan keluarga di Yogyakarta yang nyaman 
untuk menghabiskan akhir pekan. Selain menyajikan makanan yang lezat, di 
restoran...","https://www.kompas.com/food/read/2021/04/03/093300775/15-tempat-makan-keluarga-di-yogyakarta-cocok-untuk-akhir-pekan?page=all","Apr 2021"
"seturan","6 Kedai Gelato di Yogyakarta, Tempat Jajan dan Nongkrong - Kompas.com","KOMPAS.com – Yogyakarta tak hanya juara dengan makanan tradisionalnya. Kota 
Gudeg juga punya banyak kedai gelato kekinian yang menawarkan berbagai cita 
rasa...","https://www.kompas.com/food/read/2021/04/01/170900675/6-kedai-gelato-di-yogyakarta-tempat-jajan-dan-nongkrong?page=all","Apr 2021"
"seturan","Kuliner Yogyakarta Murah dan Menggiurkan - Kompasiana.com","Yogya identik dengan kota yang tenang, membuat rindu, wisata yang 
menyenangkan, dan juga harga yang murah. Namun dibalik terkenalnya Yogya 
akan wisata.","https://www.kompasiana.com/ivaniananda/5ff289308ede486cdd651022/kuliner-yogyakarta-murah-dan-menggiurkan","Jan 2021"
"seturan","15 Tempat BBQ ala Korea di Yogyakarta, Makan Daging Mulai Rp 50.000 - Kompas.com","KOMPAS.com - Pencinta daging barbeku (BBQ) ala Korea di Yogyakarta bisa 
berkunjung ke restoran Korean BBQ yang menyajikan berbagai potongan daging 
sapi.","https://www.kompas.com/food/read/2020/12/30/131300575/15-tempat-bbq-ala-korea-di-yogyakarta-makan-daging-mulai-rp-50.000?page=all","30 Des 2020"
"seturan","Es Teler Sperma di Yogya, Sempat Jadi Favorit di Bulan Puasa","Liputan6.com, Jakarta - Banyak usaha dan kreasi dilakukan para pelaku usaha 
kuliner untuk bisa mendatangkan banyak pelanggan. Salah satu contohnya 
dilakukan...","https://www.liputan6.com/lifestyle/read/4387709/es-teler-sperma-di-yogya-sempat-jadi-favorit-di-bulan-puasa","1 Okt 2020"
"seturan","10 Street Food Yogyakarta yang Viral, Wisata Kuliner Murah Meriah - Kompas.com","Yogyakarta punyak kedai jajanan kaki lima yang viral. Mulai dari lumpia 
legendaris, jenang 9 rasa, nasi babat, mi ayam, dan masih banyak lagi. 
Halaman all.","https://www.kompas.com/food/read/2020/08/25/153000275/10-street-food-yogyakarta-yang-viral-wisata-kuliner-murah-meriah?page=all","5 Agu 2020"
"seturan","Pecinta Kuliner, Ini Promo Makan Murah di Hotel Dafam Fortuna","TRIBUN-JOGJA.com - Bagi para pencinta kuliner, Hotel Dafam Fortuna 
Yogyakarta memiliki berbagai macam pilihan menu alternatif bagi Anda dan 
keluarga maupun...","https://jogja.tribunnews.com/2020/03/16/pecinta-kuliner-ini-promo-makan-murah-di-hotel-dafam-fortuna","6 Mar 2020"
